name,rating,date,text
Handy B,5,5 hari lalu,Tmpt yg penuh perjuangan saat kesini namun percaya semua lelah itu setimpal dg keindahan nya
Albert Lim,5,seminggu lalu,Beautiful beach with easy access from the local office. Cheap scuba rent. Recommended
Lord Hendrik,5,4 minggu lalu,Mantab bintang 5.
Syahri Honorofking,5,sebulan lalu,Ada yg tahu CP nya sewa tenda di pantai 3 warna kah?
HERI PURNOMO,5,sebulan lalu,Pantai paling bersih yang ada di Kabupaten Malang terletak di desa sumbermanjing Wetan tepatnya di sebelah Pantai Sendang Biru yang harus reservasi sebelum datang ke sana dan harus ditemani oleh pemandu karena lokasinya melalui perkebunan masyarakat
rizal dwi permadi,5,sebulan lalu,Boleh ngecame di sana.?
Joko Irawan,5,2 bulan lalu,Cantik banget....
Wage Yanto,3,2 bulan lalu,3 warnanya dimana? Kebanyakan biaya. Guide 150 belum naik perahu Krn jalan dari pos 2 ke 3 warna jauh. Wisata bisnis parkir motor 8 RB. Mobil 12 RB. Semua pantai sama lah
Yurika Aprilia,5,3 bulan lalu,"Baru pertama kali ke sini ternyata bagus tempatnya masih asri, ga nyesel walaupun jalannya cukup jauh. Disana juga ada warung yg harganya terjangkau,, tapi memang harus pakai tourguide kalo kesana karna masih area konservasi"
Wahyu Dwipayana,5,3 bulan lalu,"Pantai Tiga Warna benar-benar menakjubkan! 🏖️ Air lautnya jernih dengan gradasi tiga warna yang indah — biru, hijau, dan toska 🌊. Suasananya masih alami, tenang, dan bersih tanpa sampah 🌿. Cocok banget untuk snorkeling, menikmati keindahan …"
Defi Paramita,5,3 bulan lalu,"Pantai nya tenang bisa untuk berenang ataupun snorkling. Akses jalan mudah, dari loket ke pantai butuh jalan kaki sebentar."
achmed anggriawan indrapraja,5,4 bulan lalu,Cocok untuk bersemedi
Jihan Rizka,5,4 bulan lalu,"Pemandangan yang sangat indah dan memanjakan mata, sayang sekali melewatkan kesempatan untuk diving. Eksplore keindahan Alam Indonesia tidak akan mengecewakan 🌊🦀🫧 …"
Joo Imaduddine,1,4 bulan lalu,"Minggu lalu mau liburan kesini ga bisa. Berhenti deket pos katanya harus reservasi dulu. Tanya ke suami katanya bayarnya sekitar 100an per orang. Akhirnya mutusin buat gajadi, akses kebawah (menuju pantai) juga kek curam, diantar guidenya …"
Abimanyu Danu,1,4 bulan lalu,"emang landscape dan geografisnya pantai ini bagus bgt, well-built juga ada gazebo, warung, properti foto seperti terlampir. …"
katon widodo,5,5 bulan lalu,Nice beach
Anne-Sofie Benoit-Hébert,1,5 bulan lalu,We are very disappointed. Pantai Tiga Warna Beach is full of trash on the beach and in the water. It is difficult to swim without touching trash. The guided tour is not worth the trip or the price.
April Wualndari,5,5 bulan lalu,"⭐️⭐️⭐️⭐️⭐️
Pantai 3 Warna cakep banget! Airnya ada tiga warna, keren buat snorkeling. Trekking 30 menit, tapi pemandangannya worth it. Tempat bersih, murah, dan cocok buat healing. Recommended!"
yuni awwalur,5,6 bulan lalu,"pantainya landai, pasirnya lembut dan halus, ombaknya juga tidak terlalu besar, cocok unt bermain air bersama keluarga ....
3x kami kesana"
Strattos,5,6 bulan lalu,"Pantai yang dikelola dengan cukup baik. sebelum ke pantai, harus ke pos 1 dulu untuk pembelian tiket (10 ribu per orang) dan  pengarahan oleh pengelola (semua barang akan dilist dan semua sampahnya wajib dibawa kembali). …"
zaim muhammad,1,7 bulan lalu,Kalo mau ke sana gmn cara ny apa hrs boking dlu
Ayai,4,Diedit 7 bulan lalu,"Belum sempat masuk ke area pantainya. Hanya mengantar tamu ke sana.
Jadi saya akan coba mereview dari sudut pandang saya pribadi tentang area parkir mobil serta fasilitas apa saja yang disediakan di sana. …"
Ravi Fahsa,4,8 bulan lalu,"Originally en route to Teluk Asmara, we were redirected by a local driver to Pantai Tiga Warna—a hidden gem tucked within a conservation area. Access is limited to preserve the ecosystem, so advance reservation is highly recommended; we …"
Kharisma Indah Safira,5,8 bulan lalu,"Pantai yang indah , private , ada guide 120k apa lupa buat 10 orang warnanya biru ombaknya cukup tenang sepoy ,, jalan dulu 1 jam an , guide nya seruu"
Arif Mansyuri,5,8 bulan lalu,"Pantai Di selatan pulau Jawa Yang Berada Di kabupaten Malang Selatan...
Untuk Akses Masih Dalam tahap pembangunan.
Kemarin dari Jombang Ke Lokasi/Pantai Tiga Warna Berangkat Jam 3 Sampai Lokasi …"
Yovi Tri wulandari,5,8 bulan lalu,"Bagus, pantai pasir putih nya halus. Ingat ya kl kesini sampah harus dibawa pulang"
ANEKA TRANSINDO,4,8 bulan lalu,Biasa saja tak seindah dulu
Irfan Mahfudzi,3,Diedit 9 bulan lalu,Good place
Anna Suryani,4,9 bulan lalu,👍🏻👍🏻👍🏻👍🏻 …
Joedo Ichwandono,5,10 bulan lalu,"Pantai dengan deburan ombak sedang, pemandangan indah ke lautan dan pulau Sempu... Ditambah gugusan beberapa pulau karang. Jumlah pengunjung yang dibatasi 100 orang  tiap hari dan pembagian jam kedatangan per 2 jam, dengan tujuan untuk …"
Rizky Saputra,5,10 bulan lalu,Mohon informasikan cara reservasi nya dong
Widya Prajna,5,setahun lalu,"Salah satu pantai terindah di selatan Malang.

Jarak dari Kota Malang yang lumayan jauh sekitar 70km, dapat ditempuh …"
Aquillah Yasenda,4,Diedit setahun lalu,"Karena pantai ini termasuk dalam wilayah konservasi, maka ada beberapa peraturan.
- sebelum kesini pastikan harus reservasi terlebih dahulu, karena ada batas …"
Nanda Riko,5,setahun lalu,Bagus
Bilqis tourtravel,5,setahun lalu,Pantai yg sangat indah di kota malang
Indra Nawayites,5,setahun lalu,"Pantai yg memiliki konsep lain dari pantai² yg lain. Dengan mengontrol sampah dan jumlah pengunjung
Apalagi ada guide yg berkalung asbak untuk mengontrol puntung rokok pengunjung …"
Bas Kopi,5,setahun lalu,Petualangan seru di pantai dan hutan manggrov.
Kelik bramanto,4,setahun lalu,Baguss
Mas Yayan,5,setahun lalu,Tempatnya bagus sayang kemarin pas hari minggu lagi surut
Ayu Umairoh,5,setahun lalu,"Pantainya bersih, Jalannya emang agak effort ya tapi the view is amazing si.. wajib banget menjadi salah satu wist list liburan..local guidenya juga ramah,,meskipun waktu di Pantai Gatra ditinggal balik tanpa ngomong yaa😂…harus banget ke sini karena ada aktivitas air yang seru🌊🌊 …"
didik waskito,5,setahun lalu,"Pengalaman 1 snorkeling disini, luar biasa indah...harus dicoba lagi nh tempat"
Maimun Najib,5,setahun lalu,mantul 👍🏻 …
Anda Langit,1,setahun lalu,"Tidak sesuai harga, total tiket dan guide terlalu mahal tidak sesuai kebersihan dan pemandangan pantai. …"
Tutikkk Tuttt,5,setahun lalu,seperti nya bagus sekali bikin penasaran
Zendhi Saputra,2,setahun lalu,"Hari jumat tgl 28 juni 2024 mengawali kunjungan ke CMC tiga warna. Pertama trip sampai pos 1 konfirmasi booking, karna kalau ke pantai 3 warna harus booking dulu. Ini batas parkir mobil, parkir motor bisa masuk ke pos 2 proses pembayaran …"
Iwan Cahyono,1,setahun lalu,Sangat indah
Hany Kristian Prabowo,1,setahun lalu,"Pihak CMC tidak professional,

Sudah Booking H-7 untuk visit, tetapi: …"
Devana R.A,4,Diedit setahun lalu,"view gausah diraguin lagi ini cakep banget, airnya biruuu bersih dan terjaga. minusnya track masuk ke wisatanya lumayan jauhh dan harus booking+pake guide."
iqbal nurullah,5,setahun lalu,"Salah satu pantai terbaik di malang selatan
Pasir putih dan halus, air jernih dg gradasi warna yg menakjubkan"
dwi pa,5,setahun lalu,"Pantainya keren, bersih, masih sangat terjaga 👍 …"
xavier natalia,1,setahun lalu,"setelah liburan ke pantai 3 warna terkait kebersihan pantai buruk,biaya guide mahal (mahal karena cuma nganter jalan saja, tanpa nilai tambah gak worth it) bisalah dipangkas biayanya sama pengelola dengan memasang petunjuk arah yang ingin …"
Muhammad Alfarizi,4,Diedit setahun lalu,Pantai Tiga Warna berada di kawasan Clungup Mangrove Conservation. Jalannya sangat jauh tetapi sekarang dapat diminimalisir dengan memanfaatkan perahu dan ojek. Di kawasan ini kami dapat mengesplore beberapa pantai dan mangrove. Salah …
Khanaya Nayaa,5,setahun lalu,bagus keren mantap
Обучение для главбухов,3,setahun lalu,Pantainya menjijikkan. Kantong plastik dan botol berserakan di mana-mana. Airnya kotor dan tidak ada yang membersihkannya.
Dewi Novita Rachmayani,5,setahun lalu,"Pantai baguss, terjaga kebersihannya
Tour guide ramah, perjalanannya bener bener jauh buat aku yg gk pernah jalan kaki hehehe …"
Noor Asmara R,3,setahun lalu,"Barusan kami liburan ke pantai 3 warna, apa yang kami ekspektasikan terkait kebersihan pantai tercoreng, karena ketika kami ingin mengambil dokumentasi kami tidak bisa maksimal karena banyak sampahnya ... tolong bagian terkait segera di …"
Zainul Arifin S8,5,setahun lalu,Mantab
Nadiya Amelia Putri Hariyanti,5,setahun lalu,Belom pernah kesana😂 …
eka Yuliana,1,setahun lalu,Guide gak ramah..ditanya baik2 malah bentak..bagus sch pantainya
Farisian,5,setahun lalu,"Pantainya bersih, kesana pas lagi musin panas kemaren jadi pemandangannya bagus banget. Ke pantainya ada dua jalur dari sendang biru ataupun pantai gatra juga bisa. Kalau dari gatra jalan kaki sekitar 1 km tapi bisa juga nyewa kendaraan …"
Waskitho Wee,5,setahun lalu,"Cantik, warna air lautnya biru jernih. Gradasi warnanya keliatan apik, mungkin karena itu dinamain tiga warna. Gak rugi trekking jauh ke sini (sekitar hampir 2km)"
titik puspasari,5,setahun lalu,"operator mantab,"
Sofi Yanti,5,setahun lalu,"Amazing place. Clear water, beautiful views, clean air, good ambience, cute fish (snorkeling)"
Mohamad Hasanudin,5,setahun lalu,Semoga wisata ini menjadi tadabbur alam mengingat kebesaran Allah azza wajalla
Galih Satriyo Nugroho,2,setahun lalu,pantai
Lov4lia_ Vid_saving,5,Diedit 2 tahun lalu,Nice place 😍👌meski rada effort untuk jalan kaki ke 3 pantai nya 🤣 pertama melewati pantai clungup. Di situ cm pesisir GT sih sih cocok bgt buat bocil maen ... Insyaallah aman dlm pengawasan ortu jg ya tp ☺️ trus jalan LG bbrp menit ke …
Acel Boy,5,2 tahun lalu,pantai 3 warna inii memiliki keindahan yang luar biasa pantainya bersih terjaga tanpa ada sampahh  dari parkiran sampe menuju pantai lumayan jauh tapi sampai disana indah nyaa masyaaallah
Arditya Saputra,5,2 tahun lalu,Pengen kesana
Andikur,1,Diedit 2 tahun lalu,"Jalan kaki jauh karena kendaraan tidak boleh mendekati areal pantai dengan alasan konservasi, okelah itung2 olah raga. …"
Abdul Aziz ahmad,5,2 tahun lalu,Cocok untuk di kunjungi
Rully Styono,5,2 tahun lalu,Mantep
SANDI 1498,5,2 tahun lalu,"Capek jalan, tapi terobati pas dah nyampe"
Santri Embongan Rek,5,2 tahun lalu,Good
Zainab Zay,5,2 tahun lalu,"The water is clear, the sand is bright, and it's quite during weekdays. It's worthwhile to spend few hundreds thousands rupiah to visit this beauty."
achmad safandi,5,2 tahun lalu,Pantainya bersih toppp bnget
Anne’s,5,2 tahun lalu,"Airnya bener bener ijoo rasanya kya bukan pantai selatan🤣🫶🏼,
Pantainya bersihh bangettttt dan cocok kalau mau nyari tempat yang tenang.
Guide ramah, terimakasih sdh dibantu foto foto 👋🏻 …"
Eva Charisma Imelda,5,2 tahun lalu,muwatul bagus sekali
Wahyu Prastiyo,5,2 tahun lalu,Pantai hidden gem dan tidak dibuka umum harus by reservasi
Tam Roel,5,2 tahun lalu,Ini memang Hidden Paradise. Pantainya Jernih banget. Pasirnya empuk asri kontrasnya 3 warna. Kalau mau kesini harus Sewa Tour guide dulu lumayan biayanya 150rb. Jadi aku kasih saran kesini rombongan saja ya.  😎 …
weny rimbawati,5,2 tahun lalu,Baru aja kemarin aku dan suami serta 2 anakku ke pantain3 warna. Udah reservasi via wa.jadi udah tinggal jalan aja.udah di kasih tau tempat parkir mobil dmn via wa.tiket masuk nya @10k. Dan biaya tour guide nya 150k. Knp q pake tour guide …
Teguh Suwasono,5,2 tahun lalu,Pantai nya bersih dan nyaman untuk liburan
Melyatul Zavina,5,2 tahun lalu,"Hidden gem banget ini. Pantai nya cantik banget. Di balik bebukitan. Kalau dari kota, kita bakal nglewatin jalanan berkelok naik turum sebelum sampai ke daerah pantai ini. Sesampainya disana, ada guide yang bakal memandu kita ke pantainya. …"
eko sulistiyo,1,2 tahun lalu,Pantai termahal....hrs nyewa guide lah..mahal lagi...kyk berkunjung ke tempat situs sejarah aja...
ArFi MOTOVLOG,1,2 tahun lalu,Pantai mahal kalo berdua 170rb . (Tourgaet 150rb + tiket perorang 10rb ) . Klo kesini jngan pake mobil sedan .  Akses jalan susah jln jauh .. penjaga loket tidak ramah . Masih bagusan pantai pacar bayar parkir aja 10rb gk ada biyaya lgi
Raffi Aryasatya,5,2 tahun lalu,"Akses menuju lokasi harus berjalan kaki setelah dari parkiran kurang lebih 1 km, namun pemandangan yang disuguhkan luar biasa indah, salah satu pantai terindah di garis pantai malang selatan, top!!!"
Pondel Pono_haryanto,1,2 tahun lalu,"SOP nya mode intl...fasilitas kelas lokal
Pantainya tdk terlalu eksotis yg di gmbar"
Gigih Ihtiar,5,2 tahun lalu,josss tambah enak aja
Aliya Widi,5,2 tahun lalu,Pantainya cantik tapi cukup jauh perjalanannya. kurang lebih 3 jam dari malang kota dan harus jalan kaki lagi -+ 2 km an
Annisa Roudlotul Jannah,5,2 tahun lalu,"a worth place to come guys🥰✨

untuk menuju pantai ini harus booking terlebih dahulu, bisa langsung ke ig …"
Miftha Karima (EMMA),5,2 tahun lalu,"Guide keren
Pantai bersih... Kudu reservasi dulu
Bisa snorkling"
Saputro Dwy,4,2 tahun lalu,"Pantai sangat bagus banyak sampah dari pohon, pantai luas dan berasa ekslusif karena sedikit pengunjung plus lagi ombak tidak terlalu besar. Minusnya biaya lumayan (dibandingkan pantai lainya. Guide 150k +10k/org). Sbnarnya Gk ada masalah …"
Savita Vita,1,2 tahun lalu,"Sungguh di sayangkan pantai yang indah tapi banyak sampah numpuk.
Kecewa hatiku.
Tapi puas bisa main dan menikmati keindahan alam yang memukau."
Dodo Ershi,5,2 tahun lalu,"Pantai yg bersih,beruntung banget kesini hari biasa,puas menikmati.."
Abdul Khalim,5,2 tahun lalu,Pantai yang sangat indah dengan ombak yang ramah.....untuk menuju ke pantai perjalanannya di tempuh dengan berjalan kaki sekitar setengah jam
Rama Aliansyah,5,2 tahun lalu,"A beach with the local's full support. A beach inside a conservation area. For me, it's a quiet and most  beautiful beach so far. Of course it's a hidden gem."
Anak Agung Anom,5,2 tahun lalu,"Maksimal 2 jam untuk di lokasi ini, harus menggunakan pemandu lokal dan perjalanan kurang lebih 45 menit dari pos loket parkir."
Apoy Awan,4,2 tahun lalu,Suka dengan inisiatif konservasinya. Tantangan pengelolaan adalah sampah dari laut yang mungkin terbawa arus. Ketika snorkling bisa ditemui plastik bekas tali atau tas yang nyangkut di terumbu karang. Untuk kebersihan pantai perlu kerja …
Niar,5,2 tahun lalu,"Pantainya bagus, bersih juga cocok buat liburan
Jangan lupa mampir ke eyesoul sawojajar malang"
Anita Firdaus,1,2 tahun lalu,"Pantai b aja, informannya agak malas menjelaskan harus kita yg nanyak detail baru dijawab itu pun seadanya, klo mau ngecamp jangan bawa yg berat2 karna perjalanan lumayan jauh, jalan dr pantai gatra ke pantai 3 warnanya becek licin apa lagi …"
Aliya Salma Suseno,1,2 tahun lalu,ZONK
Ika SR,5,2 tahun lalu,"Bagus banget pantainya bersihh klo cuaca cerah bisa terlihat 3 warnanya
Untuk ke pantai ini sebelumnya kita harus reservasi terlebih biaya masuknya 10K tapi untuk ke pantai ini kita harus d temani oleh guide biayanya 150K …"
Nudia Adwha,4,2 tahun lalu,"Dari perkiran naik ojek k loket trs jalann jauuhhhh menuju pantai 3 warna tp seruu poll....pantai nya bagus dan sekeliling nya bersih..cuma sayang banget air nya yg kotor , bnyak banget sampah kiriman... …"
nae nae_jull,5,2 tahun lalu,"Pantai tersembunyi yang patut di kunjungi bagi  yang suka snorkeling lumayan buat explore , atau sekedar menikmati keindahan dan lagi pasir nya lembut banget , treking nya lumayan buat olah raga . Ingat harus pake guide ya kalo kesana"
Chika Putri,5,2 tahun lalu,indah sekali❤️
Desita Key,5,2 tahun lalu,"Wah Daebak .... Bagus banget, pasir putih lembut, ombak tdk se gede teluk asmara, snorkeling, minum degan aaah mantab …"
Titis Widhi Astu,1,2 tahun lalu,Repot aksesnya dan biaya yang dikeluarkan lumayan banyak karena wajib pakai pemandu Rp 150.000
Papah Chessy,5,2 tahun lalu,Keren & alami
Theresia sherly,5,2 tahun lalu,"Pantai Tiga Warna Malang ini termasuk pantai yang mahal menurut saya.

Perjalanan dari Surabaya sekitar 4-5 jam via tol turun tol Pakis. …"
Vicky Victoreo,5,Diedit 2 tahun lalu,Pantai yang paling bersih di malang
User,5,2 tahun lalu,Bagus
Nia novi27,1,2 tahun lalu,Udah jauh² ke sini dengan perjalanan 7 sampek 8 jam. Eh malah sampek lokasi ndk bisa masuk karena harus booking dulu. Kecewa banget karena ndk ada informasi yang harus booking tempat dulu😭 …
Zean,5,2 tahun lalu,"Baguss banget, Suasana dapet, adem asri, cuma jauh aja si wkwkw, sebanding ama perjalanan"
GUNUNG MAS,1,2 tahun lalu,"Jauh2 dari magelang sampai lokasi di tutup tanpa pemberitahuan,jalan menuju pantai sangat jelek"
Fahira Almira Arsyad,5,2 tahun lalu,"view pantainya bagus, ga sia2 perjalanan yg melelahkan terbayar semua"
Sunari Yanto,5,2 tahun lalu,Pantai yang indah cantik dan mempesona
Nova Dwi,5,2 tahun lalu,"Keren tempat.nya tp jalan dari parkiran ke pantainya,behhhhh membakar lemak...hhha"
jackson,5,2 tahun lalu,"Paling senang ke pantai ini, favorit saya sejak pertama kali ke sini dan sudah lebih dari 10x saya ke sini bersama anak keluarga atau teman. Pantai nya tenang, air nya jernih, ada fasilitas yg memadai. Memang di butuhkan waktu yg lama untuk …"
Karnael Elisandria,3,2 tahun lalu,"dulu saya pikir 3 warna itu memiliki warna yang khas, saat tanya ke guide dia bilang 3 warna itu agak hijau, biru muda dan biru tua"
Affa Iyy4h,1,2 tahun lalu,"Kebersihan nya kurang , air susah di sana"
Setia,5,2 tahun lalu,"harus sewa tour guide, tidak ramai karna dibatasi, snorkel bagus"
Nadia Fitriana,5,2 tahun lalu,Tempatnya bagus bersih dan tenang
Tanti Widyawati,5,2 tahun lalu,"Pantainya bagus sih dari review, waktu aku mau kesana sampai ditempat parkir itu masih jauh untuk kepantainya sekitar 3 kilo an dan mobil tidak bisa masuk harus ngojek atau bisa jalan kaki dan masih jauh, disana juga waktu main dipantainya diberi waktu karena kan supaya terjaga kelestariannya."
Ihsan Marga Wiyaksa,5,2 tahun lalu,"Keren, lingkungannya sangat terjaga dan bersih"
Lintang Gading Pramesti_,5,Diedit 3 tahun lalu,"Bagus bngt pantainya, jalannya rada jauh ya. Nglewatin 2 pantai, pantai gatra sama pantai clungup kalau gasalah. Ini foto tahun 2017. Waktu itu pantainya masih lumayan sepi, masuknya wajib hitung sampah plastik yang dibawa sama wajib sama …"
WIDODO,5,3 tahun lalu,Ok
naura elkaysa,5,3 tahun lalu,"Pesona indah pantai 3 warna, area konservasi clungup. Masyaallah.. Kereeen banget pokoknya...."
Hilman Adzim,5,3 tahun lalu,Sebelum tiba di pantai 3 warna wajib 'olahraga' dulu jalan kaki menyusuri rute jalan setapak. Pulangnya bisa mengikuti rute perahu hingga ke pasar ikan. Pengunjungnya dibatasi agar tidak terlalu crowded.
22.034.MFatihK,5,3 tahun lalu,"Salah satu pantai paling bagus dikabupaten Malang, paling tidak datang kesini walaupun cuma sekali karena emang sebagus itu pantainya"
rizkyhaksono,4,3 tahun lalu,"Pantai nya ok, cuma akses nya agak susah dilalui"
Kepanjen Media,5,3 tahun lalu,Sepi serasa milik pribadi
Sari Yuliani,5,3 tahun lalu,"Tracknya lumayan, tapi viewnya bagus. Pas kesini lagi sepi, jadi kayak pulau pribadi karena cuma kami sekeluarga disini"
Petra Paskani,5,Diedit 3 tahun lalu,Gradasi warna pantainya cantik sekali.. pantainya nyaman utk berenang krn air cukup jernih dengan pasir putih yang halus. Mudah2an ke depannya pantai ini bisa benar2 bersih dari sampah
Muhammad zaidan MD,5,3 tahun lalu,👍 …
Yas,5,3 tahun lalu,"Bagus, pantainya bersih. Kalau kesini wajib nyebranh dulu.. nggak banyak pengunjung, jadi nyaman..."
DIRK,5,3 tahun lalu,"Pengalaman Vakansi + Story + Konservasi

Featured: …"
ryan Gauloises,4,3 tahun lalu,The travel guide are so friendly and the beach is beautiful especially during summer time.
Mohammad Khamim Jazuli,5,3 tahun lalu,"Pantai yang bagus dan Jernih, Rekomended pantai di malang selatan, untuk tiket 10rb/ orang dan Guide150k/ 15 orang, jalan kaki kurang lebih 1jam dari parkir mobil, melewati pantai clungup dan pantai gatra"
Hyeni Valentina,5,Diedit 3 tahun lalu,Pantai yg indah bersih dan  alami .. pengalaman yg seru banget ... Mulai dr naik kapal dan snorkling bersama keluarga .... Pemandangan bawah lautnya indah . Terumbu karang dan ikan2 yg indah ... Pemandunya ramah dan sabar... Pokoknya seru buuaaangeettt
Gone,5,3 tahun lalu,"berkunjung ke tempat ini sangat menyenangkan, bareng travel langganan remaja travel. amazing sekali, driver dan guide ramah"
"Lilah, A",5,3 tahun lalu,"Belum sempet kesana karna ternyata setiap hari KAMIS, pantainya TUTUP.. 😭🙃 …"
Tas Ajaib,5,3 tahun lalu,PUAS DENGAN MEJANYA
Hendry Wiranto,4,Diedit 3 tahun lalu,"Great views, the beach is reall have 3 shades of green LOL 🤣
But jokes aside it's a really great sea view
I did snorkeling there but the reef is not that good …"
Dwi Nur Prakoso,1,3 tahun lalu,"Kami datang rombongan diatas 50 orang, beli yg paketan, sampe sama gak jadi snorkeling dan parahnya lagi duit kami gk dikembalikan
Dengan mudahnya ngomong gajadi snorkeling karna habis hujan, harusnya kan ada kompensasi duit dibalikin, soalnya kami diatas 50 orang lho"
Galang El Amien,1,3 tahun lalu,Waktu kesana tidak jadi sorkling tapi uang paketan tidak yang ada kembali watafak meeen
Amirudin,3,3 tahun lalu,"Pantainya bagus banget, petugasnya ramah tapi sedikit kecewa pantainya kotor mungkin karena ombak besar."
AWALIA H SAHRO,5,3 tahun lalu,"Menuju pantai cukup jauh dan melelahkan, tapi semua itu terbayar dengan pemandangan Pantai nya keren banget, pasir nya halus, pulang nya kami putuskan naik perahu dengan biaya 100rb biar ga capek dua kali, turun dari perahu lgsg cuss makan siang di resto seafood yang endoss.."
Ayo Belajar,4,3 tahun lalu,Apakah bisa untuk camping bermalam sama keluarga
Phoebe Dhi,5,Diedit 3 tahun lalu,"Absolutely the most amazing beach in Malang! Clean, natural & well maintained, the staff were friendly and helpful. …"
Desi Aria,5,3 tahun lalu,"Memutuskan pergi ke pantai ini artinya sudah siap capek. Karena untuk sampai di pantai ini memang melelahkan. Dari kota Malangnya sendiri bisa makan waktu 2-4 jam. Terus sampai di tempat parkir kendaraan, kita kudu registrasi, lalu jalan …"
Daniel Aditama,5,3 tahun lalu,Yang kesini siapin budget yg cukup buat sewa guide 150 K. Bagi yg suka tracking dan private beach OK
velove indriana,1,3 tahun lalu,Kalau kesini q saranin siapin budget yg banyak tenaga yg exstra jgn bawa anak kecil. Kalau ke tiga warna pemandu 150 wajib. Tiket 10k per orang kapal 200 pp. Jln kaki yg penuh perjuangan. Sudah banyak diongkos harus keluarin tenaga exstra …
fatiya rosyid,5,3 tahun lalu,Private beach
Muhammad mikail ar roikhan,5,3 tahun lalu,Ok
Muhammad Alif,4,3 tahun lalu,"This place is very beautiful, i think this is the best beach in malang that you must visit hahaha. Before come here you must to registered first in online website. I suggest you to come in the morning, because this beach still ups and …"
Dio Ardi Yulindra,5,3 tahun lalu,"Pantai yang cantik, bersih, pengelolaan yang baik. Dari parkiran jalan kaki ke pantai sekitar 20 menit. Untuk kesini harus booking dulu, kemudian membayar dp tour guide dan tiket masuk. Untuk tiket masuk per orang, tour guide 150rb dan 1 …"
Muhammad Fil Ardhi Satriandra,5,3 tahun lalu,"Pantainya bagus, bersih, akan ada pengecekan barang yang berpotensi menjadi sampah, karena sampah harus dibawa kembali, ada biaya parkir 15.000, lalu bisa jalan ke pos 1 atau membayar ojek seharga 5.000, biaya masuk sekitar 10.000 dan harus …"
yanisfa,5,3 tahun lalu,"Friendly and kind guide, good management conservation, limiting visitor numbers (100 people/2 hours), you need walk around 2 km from parking area to the beach, make reservation before visit here."
qanita zahidah,5,Diedit 3 tahun lalu,Pantai nya baguuuss banget meskipun harus jalan kaki 30 menit dari pos 2. Kesini bareng sama temen temen kkn buat perpisahan. Tour guide nya ramaaah bayar 150 untuk 1 group (10 org). Berhubung aku 14 org jd harus bayar 2 tour guide. …
Ria Misriyach,5,3 tahun lalu,Capek jalan kaki
santoso santoso,5,3 tahun lalu,"Keren
Saya sudah dua kali ke sini
Bersih …"
Etta Natan,4,3 tahun lalu,"Salah satu pantai yang memiliki pemandangan bagus. Agak tidak sesuai ekspektasi karena ternyata pantainya kecil, tidak seluas pantai Teluk Asmara/Watu Leter. Akses kesini juga sedikit ""mblusuk"", buat yang pakai mobil mungkin bisa agak ragu …"
maulana malik ibrahim,5,3 tahun lalu,"1.awal pintu masuk agak sempit soale masuk pemukiman warga.jarak dr parkir mobil kelaut agak jauh klo dr Gatra skitar 1.5 km
Klo ketiga warna 2.5km..bs diasati dg naik ojek 5 RB per orang..ntar turun ddket …"
Muhtar Ridhowi,5,3 tahun lalu,Pertama kali kesini agak sedikit bingung karena harus booking terlebih dahulu dan katanya setiap barang yg dibawa pulang pergi hrs sama setiap pcs nya.. akan tetapi setelah booking dan sampai pos pengelola sangat ramah dan sangat membantu …
Rohman Vicky tour,4,3 tahun lalu,"Akses jalan penuh perjuangan, perlu diperlebar dan diperluas lagi"
Nurul Zainudin,5,3 tahun lalu,Perjalanan melelahkan karena kondisi jalan jembrot habis hujan ..tiba dipantai semuanya hilang terbayar dgn keindahan dan pantai yg tenang..
"Garude Ari Mulyono, Ph.D",5,3 tahun lalu,Keren 😎😎😎 …
Elsa Mutiara RR,5,3 tahun lalu,"first time camping here and its super super fun! pantainya bersih, good facilities, dan warga lokalnya ramah. ada banyak pilihan water sport (snorkeling, kano, boat etc). Anw pertama nyobain keliling mangrove naik boat, bayar 100k/boat. …"
Be Domenk,1,3 tahun lalu,"Berharap ini pantai terbagus di kabupaten malang.. Sampe ngajak karyawan saya ke sana.. Lah kok biasa saja, anak saya aja bisa ngomong ""tidak sesuai dengan ekspektasi"" Hahahaha.. Kacau dah, biaya yg di keluarkan dengan harapan mendapat …"
Rido Permana Yudha,5,3 tahun lalu,Cantik
