name,rating,date,text
Ines Almeyda,5,setahun lalu,"capek banget jalan, tp enjoy kok
miniatur budaya Indonesia, layar interaktif juga ada tp ada beberapa yg bahasa Inggris jadi untuk anak-anak yg belum terlalu menguasai bahasa inggris agak susah …"
Natanael Andi Sanjaya,3,setahun lalu,"Banyak wahana👍
Datang pagi sampai tutup pasti di jamin puas🤝
HTM sesuai kantong🤗 …"
Ajeng Tyas,5,setahun lalu,Langganan 3x kesini studi tour
Mala 1234,5,setahun lalu,"Tmptnya nyuwaman aseliii, pelayanannya ruwamah polll aksesorisnya lengkap recom dehh uda langganan dr 2021 sampek sekarangg🥰🥰🥰 …"
Ardia Pramesti R.C,5,setahun lalu,"Semua wahana masih bisa beroperasi dengan baik, banyak yg jual makanan juga"
M.RIZKI.P,5,setahun lalu,"Tempatnya asik lalu aku sudah pernah kesitu 2 kali dan gua ga bosan.
Tempat ini recommended buat di datangin deh"
Muhammad,4,setahun lalu,"Pengunjung disuruh jalan satu arah, ga bisa milih langsung wahana yang dituju"
Jazimah Mudzakiroh,5,setahun lalu,"Terima Kasih Jatim Park 1, atas kirimanya bahkan yang menanggung pihak sana, semoga tahun depan bisa kesana lagi, Atas nama MA Al Ma'had An Nur Bantul Yogyakarta, atas bantuaanya menumakan Tas dan seperangkat lensa Kamera, Jazakumullah khoiron Jaza"
Neola Delphinea,5,setahun lalu,Wisata anak dan edukasi terbaik.
Mr Redis,5,Diedit setahun lalu,Bagus banyak permainan
Mbah Bisriyy,5,setahun lalu,Super
putri Amanda sari,5,setahun lalu,Seru untuk refreshing banyak wahana dan bisa berenang
Pingkan Caroline,5,setahun lalu,Bnyk bgt mainan nya..tp lbh enak bawa anak kecil klu ksni
Abdul Halim,5,setahun lalu,Mantap
flower white24,5,setahun lalu,"Seruu puoll, kolam renangnya bagus wahana wahana nya jugaa tempatnya luas rumah hantu nya beneran seremmm. Ada toko nya juga harganya lumayan pricey tapi worth it."
Arek Gempol,4,setahun lalu,Menyenangkan terutama buat anak anak
RFMD,5,setahun lalu,"Bagus, Pekerja yang bertugas membersihkan area parkiran (Fast)"
Alfian Bimantara,1,setahun lalu,Banyak permainan yang maintenance tiket mahal bnya perbaikan
Ayunda Siti Rohana,5,setahun lalu,"Dua kali ke sini yang pertama tahun 2016 tpi sayang pas cuaca ga mendukung jadinya ga bisa naik wahana"", kedua kalinya tahun 2024 makin tertata dan upgrade , puas naik wahana-wahananya,"
Vava Ashter,5,setahun lalu,Selalu jadi tempat liburan ter fav ❤️
Trejo Cio,1,setahun lalu,"Kesel banget sama petugas bagian pasang tiket, tadi udah jelas kasih tiket 4 eh di simpen di saku nya petugas cowo dan cewe.. berujung kita harus nungguin dan jelasin kalo tiket kita di sakuin sama mas nya dan mbaknya.. mas dan mbaknya malah muter sendiri kita disuruh nunggu lumayan lama.. SOP nya diperbaikin lagi dong"
