name,rating,date,text
madinaaa,2,2 minggu lalu,"sebenarnya pantai e bagus cuma masih banyak sampah dimana-mana, tiketnya ga memuaskan karena kemaren dgn teman-teman harusnya kami kena harga mahasiswa malah langsung dialihin pake HTM yg bukan mahasiswa alias umum, jalan menuju pantainya lumayan yaa apalagi after rain"
hakim rt,1,4 minggu lalu,Info dari Facebook
Sadira Agistya,5,sebulan lalu,"Kesini September 2024 jalanan menuju Bande Alit wonderful sejuuk bgtt klo berangkat nya pagi, jalanannya jg udh bisa diakses ga sejelek dulu. Kesini tanpa bayar tenangg bgt puas ala ala piknik gitu, ada air yg mirip kolam jg bisa rendam disitu tpi aku engga karena panas bgt wkwkwk smg jalanannya mkin Oke ya"
Keluarga Penjelajah,5,2 bulan lalu,Indah banget pantainya. Tapi jalannya ampun deh
Mohammad Dhofir,5,2 bulan lalu,Masih alami
chihiro,4,3 bulan lalu,"Kalo mau kesini, mending jangan terlalu sore deh. belum ada fasilitas lampu jalan kalo malem. jalannya susah pol (yang udah mendekati pantai) masih jalan berbatu, selain itu masih sepi orang juga soalnya di tengah perkebunan karet. ga ada …"
RUDIYANTO RUDIYANTO,3,5 bulan lalu,Dari Pusat kota Jember kurang lebih 50 Km...Nggowes yang Melelahkan tapi Asik..Alami
Dilan Dental,5,5 bulan lalu,Tempat yg sangat indah untuk dikunjungi.karna masih alami
Irul Pansa,5,6 bulan lalu,Menarik
